"file_id","type","category","subcategory","title","n_chunks","n_tokens","n_pages","tags","wiki_concepts","risk_category","source_type","author","published","source_url","summary","relpath"
"79892e1a2be7","pdf","03_Evaluations","03a_Methodology","With Little Power Comes Great Responsibility Despite its importance to experimental design","49","27323","32","evaluations|compute|benchmarks","AI Evaluations & Benchmarks|Scalable Oversight|RLHF & Its Limitations","","research_paper","","2020","https://arxiv.org/pdf/2010.06595.pdf","With Little Power Comes Great Responsibility Dallas Card1Peter Henderson1Urvashi Khandelwal1Robin Jia1 Kyle Mahowald2Dan Jurafsky1 1Stanford University, Stanford, CA 2University of California Santa Barbara, Santa Barbara, CA dcard@stanford.edu ,phend@stanford.edu , urvashik@stanford.edu ,robinjia@stanford.edu , mahowald@ucsb.edu ,jurafsky@stanford.edu Abstract Despite its importance to experimental design, statistical power (the probability that, given a real effect, an experiment will reject the null hypothesis) has largely been ignored by the NLP community. Underpowered experi- ments make it more difﬁcult to discern the difference between statistical noise and mean- ingful model improvements, and increase the chances of exaggerated ﬁndings. By meta- analyzing a set of existing NLP papers and datasets, we characterize typical power for a variety of settings and conclude that under- powered experiments are common in the NLP literature. In particular, for several tasks in the popular GLUE benchmark, small test sets mean that most attempted comparisons to state of the art models will not be adequately pow- ered.","03_Evaluations/03a_Methodology/With_Little_Power_Comes_Great_Responsibility_Despite_its_importance_to_experimental_design_5e9fd70b.pdf"
"1d92bd097411","pdf","03_Evaluations","03a_Methodology","arxiv.orgabs123 Sociotechnical Safety Evaluation of Generative AI Systems","98","56299","76","evaluations|benchmarks|disinformation|detection|adversarial|transparency|OpenAI|RSP","AI Evaluations & Benchmarks|RLHF & Its Limitations|Responsible Scaling Policies","misuse|mistakes|misalignment","research_paper","","2023","https://arxiv.org/pdf/2310.11986.pdf","arxiv.org/abs/123 2000-01-01 Sociotechnical Safety Evaluation of Generative AI Systems Laura Weidinger1, Maribeth Rauh1, Nahema Marchal1, Arianna Manzini1, Lisa Anne Hendricks1, Juan Mateos-Garcia1, Stevie Bergman1, Jackie Kay1, Conor Griffin1, Ben Bariach1, Iason Gabriel1, Verena Rieser1 and William Isaac1 1Google DeepMind, London N1C 4DN, United Kingdom Generative AI systems produce a range of risks. To ensure the safety of generative AI systems, these risks must be evaluated. In this paper, we make two main contributions toward establishing such evaluations. First,weproposeathree-layeredframeworkthattakesastructured,sociotechnicalapproach to evaluating these risks.","03_Evaluations/03a_Methodology/arxiv.orgabs123_Sociotechnical_Safety_Evaluation_of_Generative_AI_Systems_4bcc2385.pdf"
"962ee55ff0f4","pdf","03_Evaluations","03a_Methodology","common-elements-nov-2024","24","13254","24","evaluations|OpenAI|RSP|Anthropic|responsible-scaling|Google|DeepMind|autonomous-systems","AI Evaluations & Benchmarks","misalignment","research_paper","","","https://metr.org/assets/common-elements-nov-2024.pdf","Common Elements of Frontier AI Safety Policies November 2024","03_Evaluations/03a_Methodology/common-elements-nov-2024_66a59187.pdf"
"c526f89ad118","pdf","03_Evaluations","03b_Capability-Benchmarks","Aligning AI With Shared Human Values","40","19757","29","adversarial|benchmarks|RSP|reward-hacking|robustness","AI Evaluations & Benchmarks|RLHF & Its Limitations|Scalable Oversight","misalignment","research_paper","","2020","https://arxiv.org/pdf/2008.02275.pdf","Published as a conference paper at ICLR 2021 ALIGNING AI W ITHSHARED HUMAN VALUES Dan Hendrycks∗ UC BerkeleyCollin Burns* Columbia UniversitySteven Basart UChicago Andrew Critch UC BerkeleyJerry Li MicrosoftDawn Song UC BerkeleyJacob Steinhardt UC Berkeley ABSTRACT We show how to assess a language model’s knowledge of basic concepts of morality. We introduce the ETHICS dataset, a new benchmark that spans concepts in justice, well-being, duties, virtues, and commonsense morality. Models predict widespread moral judgments about diverse text scenarios. This requires connecting physical and social world knowledge to value judgements, a capability that may enable us to steer chatbot outputs or eventually regularize open-ended reinforcement learning agents.","03_Evaluations/03b_Capability-Benchmarks/Aligning_AI_With_Shared_Human_Values_0c5277a5.pdf"
"7dcb5ca631d0","pdf","03_Evaluations","03b_Capability-Benchmarks","Are Emergent Abilities of Large Language Models a","15","8808","14","InstructGPT|benchmarks","AI Evaluations & Benchmarks|RLHF & Its Limitations|Scalable Oversight","","research_paper","","2023","https://arxiv.org/pdf/2304.15004.pdf","Are Emergent Abilities of Large Language Models a Mirage? Rylan Schaeffer, Brando Miranda, and Sanmi Koyejo Computer Science, Stanford University Abstract Recent work claims that large language models display emergent abilities , abil- ities not present in smaller-scale models that are present in larger-scale models. What makes emergent abilities intriguing is two-fold: their sharpness , transition- ing seemingly instantaneously from not present to present, and their unpredictabil- ity, appearing at seemingly unforeseeable model scales. Here, we present an al- ternative explanation for emergent abilities: that for a particular task and model family, when analyzing ﬁxed model outputs, emergent abilities appear due the researcher’s choice of metric rather than due to fundamental changes in model behavior with scale.","03_Evaluations/03b_Capability-Benchmarks/Are_Emergent_Abilities_of_Large_Language_Models_a_b0c96341.pdf"
"fc3e44b735d6","pdf","03_Evaluations","03b_Capability-Benchmarks","Beyond the Imitation Game Benchmark","143","79138","95","evaluations|benchmarks|Google|detection|OpenAI|RSP|compute|adversarial","AI Evaluations & Benchmarks|RLHF & Its Limitations|Responsible Scaling Policies","mistakes","research_paper","","2022","https://arxiv.org/pdf/2206.04615.pdf","Beyond the Imitation Game: Quantifying and extrapolating the capabilities of language models Alphabetic author list:∗ Aarohi Srivastava, Abhinav Rastogi, Abhishek Rao, Abu Awal Md Shoeb, Abubakar Abid, Adam Fisch, Adam R. Brown, Adam Santoro, Aditya Gupta, Adrià Garriga-Alonso, Agnieszka Kluska, Aitor Lewkowycz, Akshat Agarwal, Alethea Power, Alex Ray, Alex Warstadt, Alexander W. Kocurek, Ali Safaya, Ali Tazarv, Alice Xiang, Alicia Parrish, Allen Nie, Aman Hussain, Amanda Askell, Amanda Dsouza, Ambrose Slone, Ameet Rahane, Anantharaman S. Iyer, Anders Andreassen, Andrea Madotto, Andrea Santilli, Andreas Stuhlmüller, Andrew Dai, Andrew La, Andrew Lampinen, Andy Zou, Angela Jiang, Angelica Chen, Anh Vuong, Animesh Gupta, Anna Gottardi, Antonio Norelli, Anu Venkatesh, Arash Gholamidavoodi, Arfa Tabassum, Arul Menezes, Arun Kirubarajan, Asher Mullokandov, Ashish Sabharwal, Austin Herrick, Avia Efrat, Aykut Erdem, Ayla Karakaş, B.","03_Evaluations/03b_Capability-Benchmarks/Beyond_the_Imitation_Game_Benchmark_b8e781bd.pdf"
"37a7032c5c3c","pdf","03_Evaluations","03b_Capability-Benchmarks","BoolQ Exploring the Surprising Difficulty of Natural YesNo Questions","24","12482","13","compute|OpenAI|adversarial|evaluations","AI Evaluations & Benchmarks|Scalable Oversight|Existential Risk & Superintelligence","","research_paper","","2019","https://arxiv.org/pdf/1905.10044.pdf","arXiv:1905.10044v1  [cs.CL]  24 May 2019BoolQ: Exploring the Surprising Difﬁculty of Natural Yes/N o Questions Christopher Clark∗1, Kenton Lee†, Ming-Wei Chang†, Tom Kwiatkowski† Michael Collins†2, Kristina Toutanova† ∗Paul G. Allen School of CSE, University of Washington csquared@cs.uw.edu †Google AI Language {kentonl, mingweichang, tomkwiat, mjcollins, kristout }@google.com Abstract In this paper we study yes/no questions that are naturally occurring — meaning that they are generated in unprompted and unconstrained settings. We build a reading comprehension dataset, BoolQ, of such questions, and show that they are unexpectedly challenging. They often query for complex, non-factoid informa- tion, and require difﬁcult entailment-like infer- ence to solve.","03_Evaluations/03b_Capability-Benchmarks/BoolQ_Exploring_the_Surprising_Difficulty_of_Natural_YesNo_Questions_284120f6.pdf"
"0bc2ce782090","pdf","03_Evaluations","03b_Capability-Benchmarks","Can Generalist Foundation Models Outcompete","23","12392","21","GPT-4|chain-of-thought|benchmarks|evaluations|OpenAI|hallucination|compute","AI Evaluations & Benchmarks","mistakes","research_paper","","2023","https://arxiv.org/pdf/2311.16452.pdf","Can Generalist Foundation Models Outcompete Special-Purpose Tuning? Case Study in Medicine Harsha Nori*‡, Yin Tat Lee*, Sheng Zhang*, Dean Carignan, Richard Edgar, Nicolo Fusi, Nicholas King, Jonathan Larson, Yuanzhi Li, Weishung Liu, Renqian Luo, Scott Mayer McKinney†, Robert Osazuwa Ness, Hoifung Poon, Tao Qin, Naoto Usuyama, Chris White, and Eric Horvitz‡ Microsoft November 2023 Abstract Generalist foundation models such as GPT-4 have displayed surprising capabilities in a wide variety of domains and tasks. Yet, there is a prevalent assumption that they cannot match specialist capabilities without intensive training of models with specialty knowledge. For example, most explorations to date on medical competency benchmarks have leveraged domain- specific training, as exemplified by efforts on BioGPT and Med-PaLM.","03_Evaluations/03b_Capability-Benchmarks/Can_Generalist_Foundation_Models_Outcompete_598f3920.pdf"
"a916b865d2f8","pdf","03_Evaluations","03b_Capability-Benchmarks","Can LLMs Generate Novel Research Ideas A Large-Scale Human Study with 100 NLP Researchers","101","52478","94","evaluations|hallucination|benchmarks|Claude|chain-of-thought|GPT-4|compute|Llama","AI Evaluations & Benchmarks|Scalable Oversight|Existential Risk & Superintelligence","mistakes","research_paper","","2024","https://arxiv.org/pdf/2409.04109.pdf","Can LLMs Generate Novel Research Ideas? A Large-Scale Human Study with 100+ NLP Researchers Chenglei Si, Diyi Yang, Tatsunori Hashimoto Stanford University {clsi, diyiy, thashim}@stanford.edu Abstract Recent advancements in large language models (LLMs) have sparked optimism about their potential to accelerate scientific discovery, with a growing number of works proposing research agents that autonomously generate and validate new ideas. Despite this, no evaluations have shown that LLM systems can take the very first step of producing novel, expert-level ideas, let alone perform the entire research process. We address this by establishing an experimental design that evaluates research idea generation while controlling for confounders and performs the first head-to-head comparison between expert NLP researchers and an LLM ideation agent.","03_Evaluations/03b_Capability-Benchmarks/Can_LLMs_Generate_Novel_Research_Ideas_A_Large-Scale_Human_Study_with_100_NLP_Researchers_96a74c22.pdf"
"f11621500e8b","pdf","03_Evaluations","03b_Capability-Benchmarks","Evaluating Large Language Models Trained on Code","140","38534","35","evaluations|OpenAI|benchmarks|compute|open-source|Llama|RSP|transparency","AI Evaluations & Benchmarks|RLHF & Its Limitations|Scalable Oversight","misuse","research_paper","","2021","https://arxiv.org/pdf/2107.03374.pdf","Evaluating Large Language Models Trained on Code Mark Chen* 1Jerry Tworek* 1Heewoo Jun* 1Qiming Yuan* 1Henrique Ponde de Oliveira Pinto* 1 Jared Kaplan* 2Harri Edwards1Yuri Burda1Nicholas Joseph2Greg Brockman1Alex Ray1Raul Puri1 Gretchen Krueger1Michael Petrov1Heidy Khlaaf3Girish Sastry1Pamela Mishkin1Brooke Chan1 Scott Gray1Nick Ryder1Mikhail Pavlov1Alethea Power1Lukasz Kaiser1Mohammad Bavarian1 Clemens Winter1Philippe Tillet1Felipe Petroski Such1Dave Cummings1Matthias Plappert1 Fotios Chantzis1Elizabeth Barnes1Ariel Herbert-Voss1William Hebgen Guss1Alex Nichol1Alex Paino1 Nikolas Tezak1Jie Tang1Igor Babuschkin1Suchir Balaji1Shantanu Jain1William Saunders1 Christopher Hesse1Andrew N. Carr1Jan Leike1Josh Achiam1Vedant Misra1Evan Morikawa1 Alec Radford1Matthew Knight1Miles Brundage1Mira Murati1Katie Mayer1Peter Welinder1 Bob McGrew1Dario Amodei2Sam McCandlish2Ilya Sutskever1Wojciech Zaremba1 Abstract We introduce Codex, a GPT language model ﬁne- tuned on publicly available code from GitHub, and study its Python code-writing capabilities. A distinct production version of Codex powers GitHub Copilot. On HumanEval, a new evalua- tion set we release to measure functional correct- ness for synthesizing programs from docstrings, our model solves 28.8% of the problems, while GPT-3 solves 0% and GPT-J solves 11.4%.","03_Evaluations/03b_Capability-Benchmarks/Evaluating_Large_Language_Models_Trained_on_Code_cfef0bfa.pdf"
"56ab59266b6d","pdf","03_Evaluations","03b_Capability-Benchmarks","Finetuned Language Models Are Zero -Shot Learners","52","31723","46","evaluations|benchmarks|InstructGPT|OpenAI|adversarial|detection","AI Evaluations & Benchmarks|Scalable Oversight|RLHF & Its Limitations","","research_paper","","2021","https://arxiv.org/pdf/2109.01652.pdf","Published as a conference paper at ICLR 2022 FINETUNED LANGUAGE MODELS AREZERO-SHOT LEARNERS Jason Wei∗, Maarten Bosma∗, Vincent Y. Zhao∗, Kelvin Guu∗, Adams Wei Yu, Brian Lester, Nan Du, Andrew M. Dai, and Quoc V . Le Google Research ABSTRACT This paper explores a simple method for improving the zero-shot learning abilities of language models.","03_Evaluations/03b_Capability-Benchmarks/Finetuned_Language_Models_Are_Zero_-Shot_Learners_0c57a508.pdf"
"e0f81dee476b","pdf","03_Evaluations","03b_Capability-Benchmarks","FrontierMath A Benchmark for Evaluating Advanced Mathematical Reasoning in AI","41","21749","28","benchmarks|evaluations|OpenAI|Claude|compute|GPT-4|Gemini|Anthropic","AI Evaluations & Benchmarks|RLHF & Its Limitations|Scalable Oversight","","research_paper","","2024","https://arxiv.org/pdf/2411.04872.pdf","FRONTIERMATH: A BENCHMARK FOREVALUATINGADVANCED MATHEMATICALREASONING INAI Elliot Glazer1†‡, Ege Erdil1†, Tamay Besiroglu1†, Diego Chicharro2‡, Evan Chen3‡, Alex Gunning4‡, Caroline Falkman Olsson1, Jean-Stanislas Denain1, Anson Ho1, Emily de Oliveira Santos5‡, Olli Järviniemi†, Matthew Barnett1, Robert Sandler1, Matej Vrzala1, Jaime Sevilla1, Qiuyu Ren6‡, Elizabeth Pratt6‡, Lionel Levine7‡, Grant Barkley8‡, Natalie Stewart8‡, Bogdan Grechuk9‡, Tetiana Grechuk9‡, Shreepranav Varma Enugandla6‡, Mark Wildon10‡, Terence Coelho15‡, Ahsan Z. Khan8‡, Will Brian11‡, Pedro Teixeira12‡, Vinh-Kha Le6‡, Jan Jurka13‡, Johannes Schmitt16‡, Sai Sanjeev Balakrishnan6‡, Peisheng Yu6‡, David Brodsky14‡, Razzi Masroor3‡, Jessica Wang17‡ Daniel Arreola18‡, Joseph Knight14‡, Noah Lebowitz-Lockard14‡, Tasos Moulinos19‡, Josh Ducey20‡ 1Epoch AI9University of Leicester17RWTH Aachen University 2King’s College London10University of Bristol18Iowa State University 3MIT11University of North Carolina19CNRS - Université Paris-Saclay 4University of Siegen12Knox College at Charlotte20James Madison University 5ICMC, USP13Masaryk University 6UC Berkeley14Independent 7Cornell University15Rutgers University 8Harvard University16ETH Zurich, position supported by SwissMAP†Core contributor ‡Contributing mathematician ABSTRACT We introduceFrontierMath, a benchmark of hundreds of original, exceptionally challenging math- ematics problems crafted and vetted by expert mathematicians. The questions cover most major branches of modern mathematics—from computationally intensive problems in number theory and real analysis to abstract questions in algebraic geometry and category theory. Solving a typical problem requires multiple hours of effort from a researcher in the relevant branch of mathematics, and for the upper end questions, multiple days.","03_Evaluations/03b_Capability-Benchmarks/FrontierMath_A_Benchmark_for_Evaluating_Advanced_Mathematical_Reasoning_in_AI_efc4b605.pdf"
"76e151bab179","pdf","03_Evaluations","03b_Capability-Benchmarks","GLUE A Multi -TASK Benchmark AND Analysis Platform FOR NATURAL Language Understand","24","15850","20","benchmarks|evaluations|Google|adversarial","AI Evaluations & Benchmarks|Scalable Oversight|Existential Risk & Superintelligence","","research_paper","","2018","https://arxiv.org/pdf/1804.07461.pdf","Published as a conference paper at ICLR 2019 GLUE: A M ULTI -TASK BENCHMARK AND ANALYSIS PLATFORM FOR NATURAL LANGUAGE UNDERSTAND - ING Alex Wang1, Amanpreet Singh1, Julian Michael2, Felix Hill3, Omer Levy2& Samuel R. Bowman1 1Courant Institute of Mathematical Sciences, New York University 2Paul G. Allen School of Computer Science & Engineering, University of Washington 3DeepMind {alexwang,amanpreet,bowman }@nyu.edu {julianjm,omerlevy }@cs.washington.edu felixhill@google.com ABSTRACT For natural language understanding (NLU) technology to be maximally useful, it must be able to process language in a way that is not exclusive to a single task, genre, or dataset. In pursuit of this objective, we introduce the General Language Understanding Evaluation (GLUE) benchmark, a collection of tools for evaluat- ing the performance of models across a diverse set of existing NLU tasks.","03_Evaluations/03b_Capability-Benchmarks/GLUE_A_Multi_-TASK_Benchmark_AND_Analysis_Platform_FOR_NATURAL_Language_Understand_1a0560a9.pdf"
"9f41cbba085c","pdf","03_Evaluations","03b_Capability-Benchmarks","GPQA A Graduate-Level Google-Proof QA Benchmark David Rein12","29","16196","28","GPT-4|benchmarks|scalable-oversight|Llama|evaluations|chain-of-thought|OpenAI|debate","Scalable Oversight|AI Evaluations & Benchmarks|RLHF & Its Limitations","mistakes","research_paper","","2023","https://arxiv.org/pdf/2311.12022.pdf","GPQA: A Graduate-Level Google-Proof Q&A Benchmark David Rein1,2Betty Li Hou1Asa Cooper Stickland1 Jackson Petty1Richard Yuanzhe Pang1Julien Dirani1 Julian Michael†1Samuel R. Bowman†1,3 1New York University2Cohere3Anthropic, PBC Abstract Wepresent GPQA,achallengingdatasetof448multiple-choicequestionswrittenby domainexpertsinbiology,physics,andchemistry. Weensurethatthequestionsare high-quality and extremely difficult: experts who have or are pursuing PhDs in the correspondingdomainsreach65%accuracy(74%whendiscountingclearmistakes the experts identified in retrospect), while highly skilled non-expert validators only reach34%accuracy,despitespendingonaverageover30minuteswithunrestricted accesstotheweb(i.e.,thequestionsare“Google-proof”). Thequestionsarealso difficultforstate-of-the-artAIsystems,withourstrongestGPT-4–basedbaseline achieving 39% accuracy.","03_Evaluations/03b_Capability-Benchmarks/GPQA_A_Graduate-Level_Google-Proof_QA_Benchmark_David_Rein12_9fcb4b1f.pdf"
"e0e2bcab9da4","pdf","03_Evaluations","03b_Capability-Benchmarks","Gemini A Family of Highly Capable Multimodal Models","92","47179","90","Gemini|benchmarks|evaluations|Google|chain-of-thought|GPT-4|red-teaming|tool-use","AI Evaluations & Benchmarks|RLHF & Its Limitations|Scalable Oversight","misuse|mistakes","research_paper","","2023","https://arxiv.org/pdf/2312.11805.pdf","Gemini: A Family of Highly Capable Multimodal Models Gemini Team, Google1 This report introduces a new family of multimodal models, Gemini, that exhibit remarkable capabilities across image, audio, video, and text understanding. The Gemini family consists of Ultra, Pro, and Nano sizes, suitable for applications ranging from complex reasoning tasks to on-device memory-constrained use-cases. Evaluation on a broad range of benchmarks shows that our most-capable Gemini Ultra model advances the state of the art in 30 of 32 of these benchmarks — notably being the first model to achieve human-expert performance on the well-studied exam benchmark MMLU, and improving the state of the art in every one of the 20 multimodal benchmarks we examined. We believe that the new capabilities of the Gemini family in cross-modal reasoning and language understanding will enable a wide variety of use cases.","03_Evaluations/03b_Capability-Benchmarks/Gemini_A_Family_of_Highly_Capable_Multimodal_Models_efa29797.pdf"
"6255f560f22b","pdf","03_Evaluations","03b_Capability-Benchmarks","Global MMLU Understanding and Addressing Cultural and Linguistic Biases in Multi 7cddb817","62","32963","57","evaluations|benchmarks|Llama|OpenAI|Claude|Google|GPT-4|open-weight","AI Evaluations & Benchmarks|RLHF & Its Limitations|Existential Risk & Superintelligence","structural","research_paper","","2024","https://arxiv.org/pdf/2412.03304.pdf","Global MMLU  : Understanding and Addressing Cultural and Linguistic Biases in Multilingual Evaluation Shivalika Singhα1, Angelika Romanou2, Clémentine Fourrier3, David I. Adelani4, Jian Gang Ngui5,6, Daniel Vila-Suero3, Peerat Limkonchotiwat5,6, Kelly Marchisio7, Wei Qi Leong5,6, Yosephine Susanto5,6, Raymond Ng5,6, Shayne Longpre8, Sebastian Ruder15, Wei-Yin Ko7, Madeline Smith1, Antoine Bosselut2, Alice Oh9, André F. T. Martins10,11, Leshem Choshen12, Daphne Ippolito13, Enzo Ferrante14, Marzieh Fadaee1, Beyza Ermisβ 1, and Sara Hookerβ 1 1Cohere For AI,2EPFL, 3Hugging Face, 4Mila, McGill University & Canada CIFAR AI Chair,5AI Singapore, 6National University of Singapore,7Cohere, 8MIT, 9KAIST, 10Instituto de Telecomunicações,11Instituto Superior Técnico, Universidade de Lisboa,12MIT, MIT-IBM Watson AI Lab,13Carnegie Mellon University, 14CONICET & Universidad de Buenos Aires,15Meta AI Research Abstract Cultural biases in multilingual datasets pose significant challenges for their effectiveness as global benchmarks.","03_Evaluations/03b_Capability-Benchmarks/Global_MMLU_Understanding_and_Addressing_Cultural_and_Linguistic_Biases_in_Multi_7cddb817.pdf"
"5eddeecda179","pdf","03_Evaluations","03b_Capability-Benchmarks","HellaSwag Can a Machine Really Finish Your Sentence","23","12606","14","adversarial|evaluations|OpenAI|benchmarks","AI Evaluations & Benchmarks|Scalable Oversight|RLHF & Its Limitations","","research_paper","","2019","https://arxiv.org/pdf/1905.07830.pdf","HellaSwag : Can a Machine Really Finish Your Sentence? Rowan Zellers♠Ari Holtzman♠Yonatan Bisk♠Ali Farhadi♠♥Yejin Choi♠♥ ♠Paul G. Allen School of Computer Science & Engineering, University of Washington ♥Allen Institute for Artiﬁcial Intelligence https://rowanzellers.com/hellaswag Abstract Recent work by Zellers et al. (2018) intro- duced a new task of commonsense natural lan- guage inference : given an event description such as “A woman sits at a piano,” a machine must select the most likely followup: “She sets her ﬁngers on the keys.” With the intro- duction of BERT (Devlin et al., 2018), near human-level performance was reached.","03_Evaluations/03b_Capability-Benchmarks/HellaSwag_Can_a_Machine_Really_Finish_Your_Sentence_2afe6f6e.pdf"
"a7b06cc5c06e","pdf","03_Evaluations","03b_Capability-Benchmarks","Humanitys Last Exam efb78592","37","22465","28","benchmarks|Gemini|evaluations|Claude|GPT-4|OpenAI|Anthropic|Google","AI Evaluations & Benchmarks|Scalable Oversight|RLHF & Its Limitations","mistakes","research_paper","","2025","https://arxiv.org/pdf/2501.14249.pdf","Humanity’s Last Exam Organizing Team Long Phan∗1, Alice Gatti∗1, Ziwen Han∗2, Nathaniel Li∗1, Josephina Hu2, Hugh Zhang‡, Chen Bo Calvin Zhang2, Mohamed Shaaban2, John Ling2, Sean Shi2, Michael Choi2, Anish Agrawal2, Arnav Chopra2, Adam Khoja1, Ryan Kim†, Richard Ren1, Jason Hausenloy1, Oliver Zhang1, Mantas Mazeika1, Summer Yue∗∗2, Alexandr Wang∗∗2, Dan Hendrycks∗∗1 1 Center for AI Safety, 2 Scale AI Dataset Contributors Dmitry Dodonov, Tung Nguyen, Daron Anderson, Mikhail Doroshenko, Alun Cennyth Stokes, Mobeen Mahmood, Oleksandr Pokutnyi, Oleg Iskra, Jessica P. Wang, John-Clark Levin, Mstyslav Kazakov, Fiona Feng, Steven Y . Feng, Haoran Zhao, Michael Yu, Varun Gangal, Chelsea Zou, Zihan Wang, Serguei Popov, Robert Gerbicz, Geoff Galgon, Johannes Schmitt, Will Yeadon, Yongki Lee, Scott Sauers, Alvaro Sanchez, Fabian Giska, Marc Roth, Søren Riis, Saiteja Utpala, Noah Burns, Gashaw M. Goshu, Mohinder Maheshbhai Naiya, Chidozie Agu, Zachary Giboney, Antrell Cheatom, Francesco Fournier-Facio, Sarah-Jane Crowson, Lennart Finke, Zerui Cheng, Jennifer Zampese, Ryan G.","03_Evaluations/03b_Capability-Benchmarks/Humanitys_Last_Exam_efb78592.pdf"
"73f2af07154d","pdf","03_Evaluations","03b_Capability-Benchmarks","Language Models are Few-Shot Learners Tom B. Brown Benjamin Mann","98","55543","75","benchmarks|evaluations|compute|OpenAI|adversarial|detection|RSP|disinformation","AI Evaluations & Benchmarks|RLHF & Its Limitations|Scalable Oversight","misuse","research_paper","","2020","https://arxiv.org/pdf/2005.14165.pdf","Language Models are Few-Shot Learners Tom B. Brown∗Benjamin Mann∗Nick Ryder∗Melanie Subbiah∗ Jared Kaplan†Prafulla Dhariwal Arvind Neelakantan Pranav Shyam Girish Sastry Amanda Askell Sandhini Agarwal Ariel Herbert-Voss Gretchen Krueger Tom Henighan Rewon Child Aditya Ramesh Daniel M. Ziegler Jeffrey Wu Clemens Winter Christopher Hesse Mark Chen Eric Sigler Mateusz Litwin Scott Gray Benjamin Chess Jack Clark Christopher Berner Sam McCandlish Alec Radford Ilya Sutskever Dario Amodei OpenAI Abstract Recent work has demonstrated substantial gains on many NLP tasks and benchmarks by pre-training on a large corpus of text followed by ﬁne-tuning on a speciﬁc task. While typically task-agnostic in architecture, this method still requires task-speciﬁc ﬁne-tuning datasets of thousands or tens of thousands of examples.","03_Evaluations/03b_Capability-Benchmarks/Language_Models_are_Few-Shot_Learners_Tom_B._Brown_Benjamin_Mann_eb9f79f3.pdf"
