"file_id","type","category","subcategory","title","n_chunks","n_tokens","n_pages","tags","wiki_concepts","risk_category","source_type","author","published","source_url","summary","relpath"
"575b9a6561ed","pdf","02_Mitigations-and-Methods","02a_RLHF-and-Limitations","koh17a","20","10754","10","adversarial|compute|robustness","AI Evaluations & Benchmarks","misalignment","research_paper","","","https://proceedings.mlr.press/v70/koh17a/koh17a.pdf","Understanding Black-box Predictions via Inﬂuence Functions Pang Wei Koh1Percy Liang1 Abstract How can we explain the predictions of a black- box model? In this paper, we use inﬂuence func- tions — a classic technique from robust statis- tics — to trace a model’s prediction through the learning algorithm and back to its training data, thereby identifying training points most respon- sible for a given prediction. To scale up inﬂuence functions to modern machine learning settings, we develop a simple, efﬁcient implementation that requires only oracle access to gradients and Hessian-vector products. We show that even on non-convex and non-differentiable models where the theory breaks down, approximations to inﬂu- ence functions can still provide valuable infor- mation.","02_Mitigations-and-Methods/02a_RLHF-and-Limitations/koh17a_2e5028fb.pdf"
"5626c3b49a76","pdf","02_Mitigations-and-Methods","02a_RLHF-and-Limitations","macglashan17a","18","9774","10","real-time|autonomous-systems","RLHF & Its Limitations","misalignment","research_paper","","","http://proceedings.mlr.press/v70/macglashan17a/macglashan17a.pdf","Interactive Learning from Policy-Dependent Human Feedback James MacGlashan1Mark K Ho2Robert Loftin3Bei Peng4Guan Wang2David L. Roberts3 Matthew E. Taylor4Michael L. Littman2 Abstract This paper investigates the problem of interac- tively learning behaviors communicated by a hu- man teacher using positive and negative feed- back.","02_Mitigations-and-Methods/02a_RLHF-and-Limitations/macglashan17a_eb343d23.pdf"
"0da1d8ec574c","pdf","02_Mitigations-and-Methods","02b_Constitutional-AI","Constitutional AI Harmlessness from AI Feedback","49","27746","34","RLHF|red-teaming|chain-of-thought|evaluations|Constitutional-AI|InstructGPT|Anthropic|transparency","RLHF & Its Limitations|AI Evaluations & Benchmarks|Constitutional AI (RLAIF)","","research_paper","","2022","https://arxiv.org/pdf/2212.08073.pdf","Constitutional AI: Harmlessness from AI Feedback Yuntao Bai∗, Saurav Kadavath, Sandipan Kundu, Amanda Askell, Jackson Kernion, Andy Jones, Anna Chen, Anna Goldie, Azalia Mirhoseini, Cameron McKinnon, Carol Chen, Catherine Olsson, Christopher Olah, Danny Hernandez, Dawn Drain, Deep Ganguli, Dustin Li, Eli Tran-Johnson, Ethan Perez, Jamie Kerr, Jared Mueller, Jeffrey Ladish, Joshua Landau, Kamal Ndousse, Kamile Lukosuite, Liane Lovitt, Michael Sellitto, Nelson Elhage, Nicholas Schiefer, Noemi Mercado, Nova DasSarma, Robert Lasenby, Robin Larson, Sam Ringer, Scott Johnston, Shauna Kravec, Sheer El Showk, Stanislav Fort, Tamera Lanham, Timothy Telleen-Lawton, Tom Conerly, Tom Henighan, Tristan Hume, Samuel R. Bowman, Zac Hatﬁeld-Dodds, Ben Mann, Dario Amodei, Nicholas Joseph, Sam McCandlish, Tom Brown, Jared Kaplan∗ Anthropic Abstract As AI systems become more capable, we would like to enlist their help to supervise other AIs. We experiment with methods for training a harmless AI assistant through self- improvement, without any human labels identifying harmful outputs. The only human oversight is provided through a list of rules or principles, and so we refer to the method as ‘Constitutional AI’.","02_Mitigations-and-Methods/02b_Constitutional-AI/Constitutional_AI_Harmlessness_from_AI_Feedback_5eacf5e7.pdf"
"5bf1bcc85cfe","pdf","02_Mitigations-and-Methods","02b_Constitutional-AI","Constitutional Classifiers Defending against Universal Jailbreaks across Thousands of Hour","99","44005","54","jailbreak|jailbreaking|red-teaming|evaluations|Claude|robustness|Anthropic|bootstrapping","AI Evaluations & Benchmarks|Jailbreaking|Scalable Oversight","misuse|structural","research_paper","","2025","https://arxiv.org/pdf/2501.18837.pdf","Constitutional Classifiers: Defending against Universal Jailbreaks across Thousands of Hours of Red Teaming Mrinank Sharma*+Meg Tong*Jesse Mu*Jerry Wei*Jorrit Kruthoff* Scott Goodfriend*Euan Ong*Alwin Peng Raj Agarwal Cem Anil Amanda Askell Nathan Bailey Joe Benton Emma Bluemke Samuel R. Bowman Eric Christiansen Hoagy Cunningham Andy Dau Anjali Gopal Rob Gilson Logan Graham Logan Howard Nimit Kalra◦Taesung Lee Kevin Lin Peter Lofgren Francesco Mosconi Clare O’Hara Catherine Olsson Linda Petrini□Samir Rajani Nikhil Saxena Alex Silverstein Tanya Singh Theodore Sumers Leonard Tang◦Kevin K. Troy Constantin Weisser◦Ruiqi Zhong Giulio Zhou Jan Leike Jared Kaplan Ethan Perez+ Safeguards Research Team, Anthropic Abstract Large language models (LLMs) are vulnerable to universal jailbreaks—prompting strategies that systematically bypass model safeguards and enable users to carry out harmful processes that require many model interactions, like manufacturing illegal substances at scale. To defend against these attacks, we introduce Constitutional Classifiers : safeguards trained on synthetic data, generated by prompting LLMs with natural language rules (i.e., a constitution) specifying permitted and restricted content.","02_Mitigations-and-Methods/02b_Constitutional-AI/Constitutional_Classifiers_Defending_against_Universal_Jailbreaks_across_Thousands_of_Hour_a49c6f96.pdf"
"bedb7cf9e0da","pdf","02_Mitigations-and-Methods","02c_Scalable-Oversight","2024-7-15 On scalable oversight with weak LLMs judging strong LLMs","57","25682","54","debate|scalable-oversight|Gemini|chain-of-thought|evaluations|benchmarks|Anthropic|DeepMind","Scalable Oversight|AI Evaluations & Benchmarks|RLHF & Its Limitations","misalignment","research_paper","","2024","https://arxiv.org/pdf/2407.04622.pdf","2024-7-15 On scalable oversight with weak LLMs judging strong LLMs Zachary Kenton*,1, Noah Y. Siegel*,1, János Kramár1, Jonah Brown-Cohen1, Samuel Albanie1, Jannis Bulian1, Rishabh Agarwal1, David Lindner1, Yunhao Tang1, Noah D. Goodman1and Rohin Shah1 *Equal contributions,1Google DeepMind Scalable oversight protocols aim to enable humans to accurately supervise superhuman AI. In this paper we study debate, where two AI’s compete to convince a judge; consultancy , where a single AI tries to convince a judge that asks questions; and compare to a baseline of direct question-answering , where the judge just answers outright without the AI.","02_Mitigations-and-Methods/02c_Scalable-Oversight/2024-7-15_On_scalable_oversight_with_weak_LLMs_judging_strong_LLMs_3c80510a.pdf"
"ebdb2baaad2d","pdf","02_Mitigations-and-Methods","02c_Scalable-Oversight","5c04925674920eb58467fb52ce4ef728-Paper","25","14019","17","OpenAI|evaluations|benchmarks|compute","Scalable Oversight|AI Evaluations & Benchmarks","misalignment","research_paper","","2021","https://proceedings.neurips.cc/paper/2021/file/5c04925674920eb58467fb52ce4ef728-Paper.pdf","True Few-Shot Learning with Language Models Ethan Perez1, Douwe Kiela2, Kyunghyun Cho13 1New York University,2Facebook AI Research, 3CIFAR Fellow in Learning in Machines & Brains perez@nyu.edu Abstract Pretrained language models (LMs) perform well on many tasks even when learning from a few examples, but prior work uses many held-out examples to tune various aspects of learning, such as hyperparameters, training objectives, and natural language templates (“prompts”). Here, we evaluate the few-shot ability of LMs when such held-out examples are unavailable, a setting we call true few-shot learning . We test two model selection criteria, cross-validation and minimum description length, for choosing LM prompts and hyperparameters in the true few-shot setting. On average, both marginally outperform random selection and greatly underperform selection based on held-out examples.","02_Mitigations-and-Methods/02c_Scalable-Oversight/5c04925674920eb58467fb52ce4ef728-Paper_116a2200.pdf"
"fd968e9801e7","pdf","02_Mitigations-and-Methods","02c_Scalable-Oversight","AI safety via debate Geoffrey Irving Paul Christiano","30","18838","24","debate|adversarial|OpenAI|robustness|deception|multi-agent","Scalable Oversight|AI Evaluations & Benchmarks|RLHF & Its Limitations","misalignment","research_paper","","2018","https://arxiv.org/pdf/1805.00899.pdf","AI safety via debate Geoﬀrey Irving∗Paul Christiano OpenAIDario Amodei Abstract To make AI systems broadly useful for challenging real-world tasks, we need them to learn complexhumangoalsandpreferences. Oneapproachtospecifyingcomplexgoalsaskshumansto judge during training which agent behaviors are safe and useful, but this approach can fail if the task is too complicated for a human to directly judge. To help address this concern, we propose training agents via self play on a zero sum debategame. Given a question or proposed action, two agents take turns making short statements up to a limit, then a human judges which of the agents gave the most true, useful information.","02_Mitigations-and-Methods/02c_Scalable-Oversight/AI_safety_via_debate_Geoffrey_Irving_Paul_Christiano_d6049e8c.pdf"
"f92f4bf9ae2e","pdf","02_Mitigations-and-Methods","02c_Scalable-Oversight","An Alignment Safety Case Sketch Based on Debate f0c460ea","32","19561","25","debate|safety-cases|scalable-oversight|alignment-faking|scheming|DeepMind|goal-misgeneralization|evaluations","Scalable Oversight|RLHF & Its Limitations|AI Evaluations & Benchmarks","misalignment|mistakes|misuse","research_paper","","2025","https://arxiv.org/pdf/2505.03989.pdf","arXiv:2505.03989v3  [cs.AI]  23 May 2025 An alignment safety case sketch based on debate Marie Davidsen Buhl marie.buhl@dsit.gov.uk UK AI Security Institute, Centre for the Governance of AI Jacob Pfau jacob.pfau@dsit.gov.uk UK AI Security Institute, New York University Benjamin Hilton benjamin.hilton@dsit.gov.uk UK AI Security Institute Geoffrey Irving geoffrey.irving@dsit.gov.uk UK AI Security Institute Abstract If AI systems match or exceed human capabilities on a wide range of tasks, it may become difficult for humans to efficiently judge their actions – making it hard to use human feedback to steer them towards desirable traits. One proposed solution is to leverage another super- human system to point out flaws in the system’s outputs via a debate. This paper outlines the value of debate for AI safety, as well as the assumptions and further research required to make debate work. It does so by sketching an “alignment safety case” – an argument that an AI system will not autonomously take actions which could lead to egregious harm, despite being able to do so.","02_Mitigations-and-Methods/02c_Scalable-Oversight/An_Alignment_Safety_Case_Sketch_Based_on_Debate_f0c460ea.pdf"
"dc508614f79f","pdf","02_Mitigations-and-Methods","02c_Scalable-Oversight","Debate Helps Supervise Unreliable Experts Julian Michael1 Jackson Petty1","85","42888","84","debate|RSP|RLHF|adversarial|GPT-4|OpenAI|deception|scalable-oversight","Scalable Oversight|RLHF & Its Limitations|AI Evaluations & Benchmarks","misalignment","research_paper","","2023","https://arxiv.org/pdf/2311.08702.pdf","Debate Helps Supervise Unreliable Experts Julian Michael∗1Salsabila Mahdi∗1David Rein∗1,2 Jackson Petty1Julien Dirani1Vishakh Padmakumar1 Samuel R. Bowman1,3 1New York University2Cohere3Anthropic, PBC Abstract As AI systems are used to answer more difficult questions and potentially help create new knowledge, judging the truthfulness of their outputs becomes more difficult and more important. How can we supervise unreliable experts —which have access to the truth but may not accurately report it—to give answers that are systematicallytrue anddon’tjust superficially seemtrue, whenthe supervisor can’ttellthedifferencebetweenthetwoontheirown? Inthiswork,weshowthat debatebetweentwounreliableexpertscanhelpanon-expertjudgemorereliably identifythetruth.","02_Mitigations-and-Methods/02c_Scalable-Oversight/Debate_Helps_Supervise_Unreliable_Experts_Julian_Michael1_Jackson_Petty1_30bea640.pdf"
"d9b4753db712","pdf","02_Mitigations-and-Methods","02c_Scalable-Oversight","Debating with More Persuasive LLMs Leads to More Truthful Answers","98","52539","72","GPT-4|debate|Claude|chain-of-thought|RLHF|adversarial|deception|scalable-oversight","Scalable Oversight|RLHF & Its Limitations|AI Evaluations & Benchmarks","misuse","research_paper","","2024","https://arxiv.org/pdf/2402.06782.pdf","Debating with More Persuasive LLMs Leads to More Truthful Answers Akbir Khan* 1John Hughes* 2 3Dan Valentine* 3Laura Ruis1Kshitij Sachan4 5Ansh Radhakrishnan4 Edward Grefenstette1Samuel R. Bowman4Tim Rockt ¨aschel1Ethan Perez4 6 Abstract Common methods for aligning large language models (LLMs) with desired behaviour heavily rely on human-labelled data. However, as models grow increasingly sophisticated, they will surpass human expertise, and the role of human evaluation will evolve into non-experts overseeing experts. In anticipation of this, we ask: can weaker mod- els assess the correctness of stronger models?","02_Mitigations-and-Methods/02c_Scalable-Oversight/Debating with More Persuasive LLMs Leads to More Truthful Answers.pdf"
"d0496f789970","pdf","02_Mitigations-and-Methods","02c_Scalable-Oversight","Debating with More Persuasive LLMs Leads to More Truthful Answers","98","52539","72","GPT-4|debate|Claude|chain-of-thought|RLHF|adversarial|deception|scalable-oversight","Scalable Oversight|RLHF & Its Limitations|AI Evaluations & Benchmarks","misuse","research_paper","","2024","https://arxiv.org/pdf/2402.06782.pdf","Debating with More Persuasive LLMs Leads to More Truthful Answers Akbir Khan* 1John Hughes* 2 3Dan Valentine* 3Laura Ruis1Kshitij Sachan4 5Ansh Radhakrishnan4 Edward Grefenstette1Samuel R. Bowman4Tim Rockt ¨aschel1Ethan Perez4 6 Abstract Common methods for aligning large language models (LLMs) with desired behaviour heavily rely on human-labelled data. However, as models grow increasingly sophisticated, they will surpass human expertise, and the role of human evaluation will evolve into non-experts overseeing experts. In anticipation of this, we ask: can weaker mod- els assess the correctness of stronger models?","02_Mitigations-and-Methods/02c_Scalable-Oversight/Debating_with_More_Persuasive_LLMs_Leads_to_More_Truthful_Answers_1838b47c.pdf"
"5ea935b9bfba","pdf","02_Mitigations-and-Methods","02c_Scalable-Oversight","Evaluating Superhuman Models with Consistency Checks Lukas Fluri","55","27663","42","evaluations|GPT-4|adversarial|chain-of-thought|OpenAI|benchmarks|autonomous-systems|x-risk","AI Evaluations & Benchmarks|RLHF & Its Limitations|Existential Risk & Superintelligence","mistakes","research_paper","","2023","https://arxiv.org/pdf/2306.09983.pdf","Evaluating Superhuman Models with Consistency Checks Lukas Fluri∗ ETH Zurich flurilu@ethz.chDaniel Paleka∗ ETH Zurich daniel.paleka@inf.ethz.chFlorian Tramèr ETH Zurich florian.tramer@inf.ethz.ch Abstract If machine learning models were to achieve superhuman abilities at various rea- soning or decision-making tasks, how would we go about evaluating such models, given that humans would necessarily be poor proxies for ground truth? In this paper, we propose a framework for evaluating superhuman models via consistency checks . Our premise is that while the correctness of superhuman decisions may be impossible to evaluate, we can still surface mistakes if the model’s decisions fail to satisfy certain logical, human-interpretable rules. We instantiate our framework on three tasks where correctness of decisions is hard to evaluate due to either superhuman model abilities, or to otherwise missing ground truth: evaluating chess positions, forecasting future events, and making legal judgments.","02_Mitigations-and-Methods/02c_Scalable-Oversight/Evaluating_Superhuman_Models_with_Consistency_Checks_Lukas_Fluri_636af9ab.pdf"
"c0518fab4226","pdf","02_Mitigations-and-Methods","02c_Scalable-Oversight","Factored Verification Detecting and Reducing Hallucination in Summaries of Acade 0ff2939a","13","6503","10","hallucination|GPT-4|Claude|OpenAI|evaluations|benchmarks|detection","RLHF & Its Limitations|AI Evaluations & Benchmarks|Scalable Oversight","mistakes","research_paper","","2023","https://arxiv.org/pdf/2310.10627.pdf","Factored Verification: Detecting and Reducing Hallucination in Summaries of Academic Papers Charlie George Elicit charlie@elicit.com Andreas Stuhlmüller Elicit andreas@elicit.com Abstract Hallucination plagues even frontier LLMs— but how bad is it really for summarizing aca- demic papers? We evaluate Factored Verifica- tion, a simple automated method for detecting hallucinations in abstractive summaries. This method sets a new SotA on hallucination de- tection in the summarization task of the HaluE- val benchmark, achieving 76.2% accuracy. We then use this method to estimate how often lan- guage models hallucinate when summarizing across multiple academic papers and find 0.62 hallucinations in the average ChatGPT (16k) summary, 0.84 for GPT-4, and 1.55 for Claude 2.","02_Mitigations-and-Methods/02c_Scalable-Oversight/Factored_Verification_Detecting_and_Reducing_Hallucination_in_Summaries_of_Acade_0ff2939a.pdf"
"bc102f2185f1","pdf","02_Mitigations-and-Methods","02c_Scalable-Oversight","Learning to Give Checkable Answers with Prover-Verifier Games","24","14166","20","adversarial|robustness|debate|evaluations|interpretability|disinformation","AI Evaluations & Benchmarks|Scalable Oversight|Interpretability","misuse","research_paper","","2021","https://arxiv.org/pdf/2108.12099.pdf","Learning to Give Checkable Answers with Prover-Veriﬁer Games ∗Cem Anil†, Guodong Zhang†, Yuhuai Wu†, Roger Grosse†, August 30, 2021 Abstract Our ability to know when to trust the decisions made by machine learning systems has not kept up with the staggering improvements in their performance, limiting their applicability in high-stakes domains. We introduce Prover-Veriﬁer Games (PVGs), a game-theoretic framework to encourage learning agents to solve decision problems in a veriﬁable manner. The PVG consists of two learners with competing objectives: a trusted veriﬁer network tries to choose the correct answer, and a more powerful but untrusted prover network attempts to persuade the veriﬁer of a particular answer, regardless of its correctness. The goal is for a reliable justiﬁcation protocol to emerge from this game.","02_Mitigations-and-Methods/02c_Scalable-Oversight/Learning_to_Give_Checkable_Answers_with_Prover-Verifier_Games_898d8f37.pdf"
"567f3bd6a8f9","pdf","02_Mitigations-and-Methods","02c_Scalable-Oversight","Measuring Progress on Scalable Oversight for Large Language Models","32","17739","21","scalable-oversight|chain-of-thought|RLHF|Anthropic|debate|evaluations|RSP|reward-modeling","Scalable Oversight|AI Evaluations & Benchmarks|RLHF & Its Limitations","","research_paper","","2022","https://arxiv.org/pdf/2211.03540.pdf","Measuring Progress on Scalable Oversight for Large Language Models Samuel R. Bowman∗, Jeeyoon Hyun, Ethan Perez, Edwin Chen,†Craig Pettit,†Scott Heiner,†Kamil ˙e Lukoši ¯ut˙e,‡ Amanda Askell, Andy Jones, Anna Chen, Anna Goldie, Azalia Mirhoseini, Cameron McKinnon, Christopher Olah, Daniela Amodei, Dario Amodei, Dawn Drain, Dustin Li, Eli Tran-Johnson, Jack Clark, Jackson Kernion, Jamie Kerr, Jared Mueller, Jeffrey Ladish, Joshua Landau, Kamal Ndousse, Liane Lovitt, Nelson Elhage, Nicholas Schiefer, Nicholas Joseph, Noemí Mercado, Nova DasSarma, Robin Larson, Sam McCandlish, Sandipan Kundu, Scott Johnston, Shauna Kravec, Sheer El Showk, Stanislav Fort, Timothy Telleen-Lawton, Tom Brown, Tom Henighan, Tristan Hume, Yuntao Bai, Zac Hatﬁeld-Dodds, Ben Mann, and Jared Kaplan∗ Anthropic,†Surge AI,‡Independent Researcher Abstract Developing safe and useful general-purpose AI systems will require us to make progress onscalable oversight : the problem of supervising systems that potentially outperform us on most skills relevant to the task at hand. Empirical work on this problem is not straight- forward, since we do not yet have systems that broadly exceed our abilities. This paper discusses one of the major ways we think about this problem, with a focus on ways it can be studied empirically.","02_Mitigations-and-Methods/02c_Scalable-Oversight/Measuring_Progress_on_Scalable_Oversight_for_Large_Language_Models_1eb4fb86.pdf"
"f69ddf1a92b7","pdf","02_Mitigations-and-Methods","02c_Scalable-Oversight","On scalable oversight with weak LLMs judging strong LLMs","57","25682","54","debate|scalable-oversight|Gemini|chain-of-thought|evaluations|benchmarks|Anthropic|DeepMind","Scalable Oversight|AI Evaluations & Benchmarks|RLHF & Its Limitations","misalignment","research_paper","","2024","https://arxiv.org/pdf/2407.04622.pdf","2024-7-15 On scalable oversight with weak LLMs judging strong LLMs Zachary Kenton*,1, Noah Y. Siegel*,1, János Kramár1, Jonah Brown-Cohen1, Samuel Albanie1, Jannis Bulian1, Rishabh Agarwal1, David Lindner1, Yunhao Tang1, Noah D. Goodman1and Rohin Shah1 *Equal contributions,1Google DeepMind Scalable oversight protocols aim to enable humans to accurately supervise superhuman AI. In this paper we study debate, where two AI’s compete to convince a judge; consultancy , where a single AI tries to convince a judge that asks questions; and compare to a baseline of direct question-answering , where the judge just answers outright without the AI.","02_Mitigations-and-Methods/02c_Scalable-Oversight/On scalable oversight with weak LLMs judging strong LLMs.pdf"
"1c07fd32c55f","pdf","02_Mitigations-and-Methods","02c_Scalable-Oversight","P ROVER - VERIFIER GAMES IMPROVE LEGIBILITY OF LLM OUTPUTS Jan Hendrik Kirchner","50","24909","34","adversarial|Goodharts-law|robustness|evaluations|chain-of-thought|compute|GPT-4|debate","AI Evaluations & Benchmarks|RLHF & Its Limitations|Scalable Oversight","mistakes|misalignment","research_paper","","2024","https://arxiv.org/pdf/2407.13692.pdf","PROVER -VERIFIER GAMES IMPROVE LEGIBILITY OF LLM OUTPUTS Jan Hendrik Kirchner∗Yining Chen∗ Harri Edwards†Jan Leike†Nat McAleese Yuri Burda† OpenAI ABSTRACT One way to increase confidence in the outputs of Large Language Models (LLMs) is to support them with reasoning that is clear and easy to check — a property we call legibility. We study legibility in the context of solving grade-school math problems and show that optimizing chain-of-thought solutions only for answer correctness can make them less legible. To mitigate the loss in legibility, we propose a training algorithm inspired by Prover-Verifier Game from Anil et al. (2021).","02_Mitigations-and-Methods/02c_Scalable-Oversight/P_ROVER_-_VERIFIER_GAMES_IMPROVE_LEGIBILITY_OF_LLM_OUTPUTS_Jan_Hendrik_Kirchner_9ab7ee86.pdf"
"f59558d75271","pdf","02_Mitigations-and-Methods","02c_Scalable-Oversight","Scalable AI Safety via Doubly-Efficient Debate Jonah Brown-Cohen Google DeepMind","26","14574","20","debate|DeepMind|Google|scalable-oversight|reward-modeling","Scalable Oversight|RLHF & Its Limitations","","research_paper","","2023","https://arxiv.org/pdf/2311.14125.pdf","Scalable AI Safety via Doubly-Efficient Debate Jonah Brown-Cohen Google DeepMind jonahbc@google.comGeoffrey Irving Google DeepMind geoffreyi@google.comGeorgios Piliouras Google DeepMind gpil@google.com November 27, 2023 Abstract The emergence of pre-trained AI systems with powerful capabilities across a diverse and ever-increasing set of complex domains has raised a critical challenge for AI safety as tasks can become too complicated for humans to judge directly. Irving et al. [2018] proposed a debate method in this direction with the goal of pitting the power of such AI models against each other until the problem of identifying (mis)-alignment is broken down into a manageable subtask. While the promise of this approach is clear, the original framework was based on the assumption that the honest strategy is able to simulate deterministic AI systems for an exponential number of steps, limiting its applicability. In this paper, we show how to address these challenges by designing a new set of debate protocols where the honest strategy can always succeed using a simulation of a polynomial number of steps, whilst being able to verify the alignment of stochastic AI systems, even when the dishonest strategy is allowed to use exponentially many simulation steps. 1 Introduction Large language models (LLMs) have demonstrated emergent capabilities, including the ability to follow natural-language instructions, use various tools, and perform some types of general-purpose abstract reasoning and planning [Saunders et al., 2022, Yao et al., 2023, Menick et al., 2022, Zhou et al., 2023].","02_Mitigations-and-Methods/02c_Scalable-Oversight/Scalable_AI_Safety_via_Doubly-Efficient_Debate_Jonah_Brown-Cohen_Google_DeepMind_071a04c8.pdf"
