"file_id","type","category","subcategory","title","n_chunks","n_tokens","n_pages","tags","wiki_concepts","risk_category","source_type","author","published","source_url","summary","relpath"
"671372747162","md","05_Resources","05a_Educational","AI Safety Conferences & Symposia — Full Roster (137)","12","6381","0","llm-security|background-reading","","misuse|misalignment","reference","HARLEM (curated)","","Notion database ""AI Safety Conferences & Symposia""","Full snapshot of the 137-row Notion conference database (fetched 2026-07-04) — academic ML/security venues, industry summits, governance forums, and alignment-community events tracked for the AI-security researcher roster, with year, location, focus areas, join priority, and roster-participant counts.","05_Resources/05a_Educational/AI-Safety-Conferences-Full-Roster-137.md"
"cf20154bcfdb","md","05_Resources","05a_Educational","AI Safety Fellowships — Full Roster (34)","35","3848","0","fellowships|funding|field-building|careers","AI Safety Field-Building","structural","reference","Notion AI Safety Fellowships DB (mirror)","2026-07-04","","Deterministic mirror of the 34-row ""AI Safety Fellowships"" Notion DB (snapshot 2026-07-04), maintained by the daily fellowships sync (`people_directory/sync_fellowships.py`). The Notion DB is the source of truth for program status/deadline/funding; researcher placements come from the researchers-to-follow file. Do not edit by hand — edits belong in Notion or the researchers file.","05_Resources/05a_Educational/AI-Safety-Fellowships-Full-Roster-34.md"
"f7323bf0cfc1","md","05_Resources","05a_Educational","AI Security & Safety — Organizations: Full Roster (200)","10","1796","0","llm-security|guardrails","Prompt Injection|Jailbreaking|Guardrails","misuse","reference","HARLEM (curated)","","Notion table ""AI Security & Safety — Organizations""","Full roster of 200 verified AI security & safety organizations extracted from the Notion orgs table (2026-06-29) — frontier labs, dedicated LLM-security vendors, open-source tools, standards bodies, government/security agencies, nonprofits, and academic centers, grouped by whether they publish their own prompt-injection/jailbreaking definitions.","05_Resources/05a_Educational/AI-Security-Orgs-Full-Roster-200.md"
"f26e7c43c30c","md","05_Resources","05a_Educational","AI Security & Safety — Researchers to Follow","235","92374","0","people-to-follow|researchers|organizations|reference|llm-security","Prompt Injection|Jailbreaking|Guardrails","misuse","derived","","","","Researcher-first who-to-follow reference across the AI security/safety roster. People are chosen for research footprint (papers, benchmarks, attacks/defenses, talks, fellowships). Deep-dive refresh 2026-06-30: every entry re-researched and expanded with current 2025-26 work; 40 researchers added; thin-research figures flagged rather than removed; empty orgs filled where a researcher exists. Fellowship scan 2026-07-01: every program in the AI Safety Fellowships tracker scanned for staff/mentors/speakers/organizers — 32 existing entries tagged with their program (the new Fellowship & Program Involvement section) and 88 new people added. Conference-DB cross-check 2026-07-04: 21 people added from conference verification.","05_Resources/05a_Educational/AI-Security-Researchers-to-Follow.md"
"d030689f2602","md","05_Resources","05a_Educational","BadLlama 3","1","116","0","evaluations|benchmarks","AI Evaluations & Benchmarks","misalignment","educational","Dewi Erwan","2024-06-19","https://aisafetyfundamentals.com/projects/badllama-3-remove-safety-finetuning-from-llama-3-8b-instruct-for-a-few-cents","Remove safety finetuning from Llama-3-8B-Instruct for a few cents","05_Resources/05a_Educational/BadLlama_3_d33b0c77.md"
"02565a725d15","md","05_Resources","05a_Educational","CS 188 Fall 2024","1","422","0","AGI","Existential Risk & Superintelligence","misalignment","blog_post","","","https://inst.eecs.berkeley.edu/~cs188/fa24","This site is outdated! For the latest content, please visit the [Spring 2025 website](https://inst.eecs.berkeley.edu/~cs188/sp25/)","05_Resources/05a_Educational/CS_188_Fall_2024_968558fc.md"
"9f461ac2582e","md","05_Resources","05a_Educational","Can we scale human feedback for complex AI tasks? An intro to scalable oversight.","12","4566","0","scalable-oversight|IDA|recursive-reward-modeling|debate|W2SG|sycophancy","Scalable Oversight|RLHF & Its Limitations|Constitutional AI (RLAIF)|Weak-to-Strong Generalization","misalignment","educational","['[[Adam Jones]]']","2024-03-18","https://blog.bluedot.org/p/scalable-oversight-intro?utm_source=bluedot-impact","Reinforcement learning from human feedback (RLHF) has emerged as a powerful technique for steering large language models (LLMs) toward desired behaviours.","05_Resources/05a_Educational/Can we scale human feedback for complex AI tasks? An intro to scalable oversight..md"
"8230a48834ec","md","05_Resources","05a_Educational","Can we scale human feedback for complex AI tasks? An intro to scalable oversight.","10","4437","0","RLHF|scalable-oversight","RLHF & Its Limitations|Scalable Oversight","misalignment","educational","Adam Jones","2024-03-18","https://aisafetyfundamentals.com/blog/scalable-oversight-intro","Reinforcement learning from human feedback (RLHF) has emerged as a powerful technique for steering large language models (LLMs) toward desired behaviours.","05_Resources/05a_Educational/Can_we_scale_human_feedback_for_complex_AI_tasks_An_intro_to_scalable_oversight._11db026c.md"
"a8e3f510ad9a","md","05_Resources","05a_Educational","Can we scale human feedback for complex AI tasks? An intro to scalable oversight.","10","4437","0","RLHF|scalable-oversight","RLHF & Its Limitations|Scalable Oversight","misalignment","educational","Adam Jones","2024-03-18","https://bluedot.org/blog/scalable-oversight-intro","Reinforcement learning from human feedback (RLHF) has emerged as a powerful technique for steering large language models (LLMs) toward desired behaviours.","05_Resources/05a_Educational/Can_we_scale_human_feedback_for_complex_AI_tasks_An_intro_to_scalable_oversight._814aa54b.md"
"d8bdf7830157","md","05_Resources","05a_Educational","Future of AI Course | BlueDot Impact","7","649","0","x-risk|existential-risk|AGI","Existential Risk & Superintelligence","misalignment","educational","","","https://bluedot.org/courses/future-of-ai?utm_source=civai","Understand what's coming. Join the conversation. Get informed about AI's trajectory and society's biggest choices in just 2 hours. No technical background needed.","05_Resources/05a_Educational/Future_of_AI_Course_BlueDot_Impact_100477de.md"
"e45cdaebbbf1","md","05_Resources","05a_Educational","Illustrating Reinforcement Learning from Human Feedback (RLHF)","15","5554","0","RLHF|PPO|reward-modeling|InstructGPT","RLHF & Its Limitations","misalignment","educational","['[[Nathan Lambert]]', '[[Louis Castricato]]', '[[Leandro von Werra]]', '[[Alex Havrilla]]']","2022-12-09","https://huggingface.co/blog/rlhf?utm_source=bluedot-impact","We’re on a journey to advance and democratize artificial intelligence through open source and open science.","05_Resources/05a_Educational/Illustrating Reinforcement Learning from Human Feedback (RLHF).md"
"f76b5e21d676","md","05_Resources","05a_Educational","MATS Research","9","4170","0","deception|Anthropic|interpretability|mechanistic-interpretability|transparency","RLHF & Its Limitations","misalignment","blog_post","","2023-09-15","https://www.matsprogram.org/","The MATS Program is an independent research and educational seminar program that connects talented scholars with top mentors in the fields of AI alignment, governance, and security.","05_Resources/05a_Educational/MATS_Research_fb0dee66.md"
"912566f5438e","md","05_Resources","05a_Educational","Reinforcement Learning from Human Feedback (RLHF): A Simple Explainer","2","1050","0","RLHF","RLHF & Its Limitations","misalignment","blog_post","Sarah","2025-05-16","https://bluedot.org/blog/rlhf-explainer","Many people worry about risks from advanced AI, from loss-of-control to misuse by bad actors.","05_Resources/05a_Educational/Reinforcement_Learning_from_Human_Feedback_RLHF_A_Simple_Explainer_e0204920.md"
"50bc73fc8fa0","md","05_Resources","05a_Educational","Robert Kirk — Personal Blog","3","535","0","Meta|interpretability|cyber-offense|governance|mechanistic-interpretability|regulation","Existential Risk & Superintelligence","misalignment|misuse|structural","blog_post","Robert Kirk","2021-11-18","https://robertkirk.github.io/","A blog about AI, NLP, RL, Meta Learning, AI safety, Interpretability and who knows what else.","05_Resources/05a_Educational/Robert_Kirk_Personal_Blog_2f5a1bdc.md"
"7eba3cea88df","md","05_Resources","05a_Educational","What is AI alignment?","11","3977","0","automated-alignment|outer-alignment|inner-alignment|reward-hacking|goal-misgeneralization","RLHF & Its Limitations|Scalable Oversight","misalignment","educational","['[[Adam Jones]]']","2024-03-02","https://blog.bluedot.org/p/what-is-ai-alignment?utm_source=bluedot-impact","This article explains key concepts that come up in the context of AI alignment.","05_Resources/05a_Educational/What is AI alignment?.md"
"a62476da7ef5","md","05_Resources","05a_Educational","What is AI debate, and can it make systems safer?","7","1325","0","debate|scalable-oversight|collusion|persuasion","Scalable Oversight","misalignment","educational","['[[Sarah]]']","2025-04-24","https://blog.bluedot.org/p/what-is-ai-debate-and-can-it-make-systems-safer?utm_source=bluedot-impact","Can we make AI systems safer by having them debate each other?","05_Resources/05a_Educational/What is AI debate, and can it make systems safer?.md"
"24374c2d0b32","md","05_Resources","05a_Educational","What is Weak-to-Strong Generalisation?","4","1228","0","W2SG|superalignment|bootstrapping|reward-modeling","Weak-to-Strong Generalization|Scalable Oversight","misalignment","educational","['[[Sarah]]']","2025-05-01","https://blog.bluedot.org/p/what-is-weak-to-strong-generalisation?utm_source=bluedot-impact","Weak-to-strong generalisation refers to the phenomenon that weaker AI models can sometimes be used to train and improve more powerful ones.","05_Resources/05a_Educational/What is Weak-to-Strong Generalisation?.md"
"2cc6f4cfe14a","md","05_Resources","05a_Educational","What is deliberative alignment?","7","1876","0","deliberative-alignment|CoT-monitoring|outer-alignment|chain-of-thought","RLHF & Its Limitations|Constitutional AI (RLAIF)|Alignment Faking & Scheming","misalignment","educational","['[[Sarah]]']","2025-05-23","https://blog.bluedot.org/p/deliberative-alignment?utm_source=bluedot-impact","Deliberative alignment is a strategy proposed by OpenAI for ensuring that AI models act according to human preferences.","05_Resources/05a_Educational/What is deliberative alignment?.md"
"58eec324292e","md","05_Resources","05a_Educational","What is input data filtration in AI safety?","9","1547","0","data-filtering|dual-use|dangerous-capabilities|unlearning","Pretraining Data Filtering","misuse","educational","['[[Sarah]]']","2025-06-05","https://blog.bluedot.org/p/data-filtration?utm_source=bluedot-impact","Large Language Models (LLMs) are trained with vast amounts of data, largely scraped from internet text.","05_Resources/05a_Educational/What is input data filtration in AI safety?.md"
"d5b974ccd49c","md","05_Resources","05a_Educational","What is AI alignment?","7","3592","0","governance|existential-risk|AGI|catastrophic-risk|extinction|jailbreaking","Scalable Oversight|Existential Risk & Superintelligence","misuse","educational","Adam Jones","2024-03-01","https://aisafetyfundamentals.com/blog/what-is-ai-alignment","This article explains key concepts that come up in the context of AI alignment.","05_Resources/05a_Educational/What_is_AI_alignment_510ee1d0.md"
"37d8dd018bfc","md","05_Resources","05a_Educational","What is AI alignment?","7","3592","0","governance|existential-risk|AGI|catastrophic-risk|extinction|jailbreaking","Scalable Oversight|Existential Risk & Superintelligence","misuse","educational","Adam Jones","2024-03-01","https://bluedot.org/blog/what-is-ai-alignment?utm_source=civai","This article explains key concepts that come up in the context of AI alignment.","05_Resources/05a_Educational/What_is_AI_alignment_c1a9b2f0.md"
"c475fa6e119a","md","05_Resources","05a_Educational","What is Recursive Reward Modelling?","3","1191","0","RLHF|reward-modeling|recursive-reward-modeling","RLHF & Its Limitations","misalignment","blog_post","Sarah","2025-05-03","https://bluedot.org/blog/what-is-recursive-reward-modelling","The main approach used today to ensure AI systems behave in accordance with human preferences is Reinforcement Learning from Human Feedback (RLHF).","05_Resources/05a_Educational/What_is_Recursive_Reward_Modelling_b2db8f27.md"
"b245ef5b480c","md","05_Resources","05a_Educational","What is supervised fine-tuning?","3","1178","0","RLHF|superalignment|OpenAI","RLHF & Its Limitations","misalignment","educational","Sarah","2025-05-10","https://bluedot.org/blog/what-is-supervised-fine-tuning","Supervised fine-tuning (SFT) is one step in the process of aligning AI models with human preferences, by training them on a dataset of examples showing desired behaviour.","05_Resources/05a_Educational/What_is_supervised_fine-tuning_ea12b59d.md"
"e6d417c76594","md","05_Resources","05a_Educational","What is the alignment problem?","5","1211","0","OpenAI|DeepMind","RLHF & Its Limitations|AI Evaluations & Benchmarks","misalignment","blog_post","Jan Leike","2022-03-29","https://aligned.substack.com/p/what-is-alignment","On a very high level, building performant AI systems requires two ingredients:","05_Resources/05a_Educational/What_is_the_alignment_problem_c4c79e06.md"
"0e24a4299b44","md","05_Resources","05b_Sources-Background","Anthropic Raises $450 Million in Series C Funding to Scale Reliable AI Products","1","577","0","Anthropic|background-reading","Responsible Scaling Policies","structural","blog_post","","2023-11-03","https://www.anthropic.com/news/anthropic-series-c","May 2023 Anthropic press release announcing $450M Series C raise (Spark Capital lead, with Google participation). Useful as a corporate-history reference point for Anthropic's funding trajectory and stated mission, not as research.","05_Resources/05b_Sources-Background/Anthropic_Raises_450_Million_Series_C_ac35f548.md"
"527df57d1d07","md","05_Resources","05b_Sources-Background","Apollo Research","2","82","0","scheming|evaluations|governance|AGI","AI Evaluations & Benchmarks","misalignment","blog_post","","2026-04-23","https://www.apolloresearch.ai/","Apollo Research is focused on reducing risks from scheming frontier AI. We conduct fundamental research into the science of scheming and run pre-deployment evaluations of frontier AI systems. Our governance team provides global policymakers with expert technical guidance, and our product team builds AGI safety tools to monitor and secure frontier AI agents.","05_Resources/05b_Sources-Background/Apollo_Research_057bf1be.md"
"261f03fa1fb9","md","05_Resources","05b_Sources-Background","Assurance contract - Wikipedia","2","972","0","background-reading","Existential Risk & Superintelligence","misalignment","blog_post","","","https://en.wikipedia.org/wiki/Assurance_contract","An assurance contract, also known as a provision point mechanism, or crowdaction, [1] is a","05_Resources/05b_Sources-Background/Assurance_contract_-_Wikipedia_05c9efe6.md"
"1b111df97c3d","md","05_Resources","05b_Sources-Background","Atoms for Peace - Wikipedia","5","2066","0","background-reading|governance|regulation","Existential Risk & Superintelligence","misalignment|structural","blog_post","","","https://en.wikipedia.org/wiki/Atoms_for_Peace","I feel impelled to speak today in a language that in a sense is new—one which I, who have spent so much of my life in the military profession, would have preferred never to use.","05_Resources/05b_Sources-Background/Atoms_for_Peace_-_Wikipedia_5e142ed9.md"
"d1206b79e3ac","md","05_Resources","05b_Sources-Background","BLEU - Wikipedia","6","3016","0","background-reading|benchmarks|evaluations","AI Evaluations & Benchmarks","misalignment","blog_post","","","https://en.wikipedia.org/wiki/BLEU","**BLEU** (**bilingual evaluation understudy**) is an algorithm for [evaluating](https://en.wikipedia.org/wiki/Evaluation_of_machine_translation) the quality of text which has been [machine-translated](https://en.wikipedia.org/wiki/Machine_translation) from one [natural language](https://en.wikipedia.org/wiki/Natural_language) to another. Quality is considered to be the correspondence between a machine's output and that of a human: ""the closer a machine translation is to a professional human translation, the better it is"" – this is the central idea behind BLEU. [1] Invented at","05_Resources/05b_Sources-Background/BLEU_-_Wikipedia_1eb08290.md"
"3879afec36f0","md","05_Resources","05b_Sources-Background","Baruch Plan - Wikipedia","4","1866","0","background-reading|governance|regulation","Existential Risk & Superintelligence","misalignment|structural","blog_post","","","https://en.wikipedia.org/wiki/Baruch_Plan","The Baruch Plan was a proposal put forward by the United States government on 14 June 1946 to the United Nations Atomic Energy Commission (UNAEC) during its first meeting.","05_Resources/05b_Sources-Background/Baruch_Plan_-_Wikipedia_20604dc4.md"
"40ea8bdfaa67","md","05_Resources","05b_Sources-Background","Bayes factor - Wikipedia","6","2810","0","background-reading|benchmarks|evaluations","AI Evaluations & Benchmarks","misalignment","blog_post","","","https://en.wikipedia.org/wiki/Bayes_factor","For certain special cases, simplified algebraic expressions can be derived; for instance, the Savage–Dickey density ratio in the case of a precise (equality constrained) hypothesis against an unrestricted alternative.","05_Resources/05b_Sources-Background/Bayes_factor_-_Wikipedia_2aa0afd6.md"
"910fe6520932","md","05_Resources","05b_Sources-Background","Buck's Shortform","112","53240","0","catastrophic-risk","AI Evaluations & Benchmarks","misalignment","blog_post","Buck","2024-02-01","https://www.lesswrong.com/posts/tmWMuY5HCSNXXZ9oq/buck-s-shortform?commentId=TNFatFiqHd8BpAXEp","This is a special post for quick takes by Buck. Only they can create top-level comments. Comments here also appear on the Quick Takes page and All Posts page.","05_Resources/05b_Sources-Background/Buck_S_Shortform_f162cf38.md"
"2182fe74d088","md","05_Resources","05b_Sources-Background","CAR T cell - Wikipedia","24","12819","0","background-reading","Pretraining Data Filtering","misuse","blog_post","","","https://en.wikipedia.org/wiki/CAR_T_cell","In biology, chimeric antigen receptors (CARs)—also known as chimeric immunoreceptors, chimeric T cell receptors or artificial T cell receptors—are receptor) proteins that have been engineered to give T cells the new ability to target a specific antigen.","05_Resources/05b_Sources-Background/CAR_T_cell_-_Wikipedia_17b955b4.md"
"4846dbdfc94d","md","05_Resources","05b_Sources-Background","CBRN defense - Wikipedia","12","5713","0","background-reading","Pretraining Data Filtering","misuse","blog_post","","","https://en.wikipedia.org/wiki/CBRN_defense","This article needs attention from an expert in military history.","05_Resources/05b_Sources-Background/CBRN_defense_-_Wikipedia_7dc02fd5.md"
"4efab7f28fc8","md","05_Resources","05b_Sources-Background","CLARITY - Wikipedia","6","2382","0","AGI|background-reading|existential-risk|governance|regulation|superintelligence|x-risk","Pretraining Data Filtering","misalignment|structural","blog_post","","2013-05-01","https://en.wikipedia.org/wiki/CLARITY","The large majority of non-lipid molecules, such as proteins and DNA, remain unaffected by this procedure, thanks to the acrylamide gel and chemical properties of the molecules involved.","05_Resources/05b_Sources-Background/CLARITY_-_Wikipedia_23c62aeb.md"
"74f3e6d441d5","md","05_Resources","05b_Sources-Background","Concorde - Wikipedia","43","21902","0","background-reading|governance|regulation","Responsible Scaling Policies","structural","blog_post","","","https://en.wikipedia.org/wiki/Concorde","Delays and cost overruns pushed costs to £1.5–2.1 billion in 1976 (£12–16.7 billion in 2025).","05_Resources/05b_Sources-Background/Concorde_-_Wikipedia_12110b87.md"
"c9e532cc4328","md","05_Resources","05b_Sources-Background","Confidential computing - Wikipedia","10","5605","0","background-reading","Responsible Scaling Policies","misalignment","blog_post","","2023-03-16","https://en.wikipedia.org/wiki/Confidential_computing","Confidential computing is promoted by the Confidential Computing Consortium (CCC) industry group, whose membership includes major providers of the technology.[[4]](https://en.wikipedia.org#citenote-rashid-4)","05_Resources/05b_Sources-Background/Confidential_computing_-_Wikipedia_8466b72c.md"
"50af3500bb5e","md","05_Resources","05b_Sources-Background","Construct validity - Wikipedia","9","4167","0","background-reading","AI Evaluations & Benchmarks","misalignment","blog_post","","","https://en.wikipedia.org/wiki/Construct_validity","Construct validity is essential to the perceived overall validity of the test.","05_Resources/05b_Sources-Background/Construct_validity_-_Wikipedia_d940ad0b.md"
"9aebb2235134","md","05_Resources","05b_Sources-Background","Countries that are democracies and autocracies","3","981","0","background-reading","Existential Risk & Superintelligence","structural","blog_post","","2026-04-21","https://ourworldindata.org/grapher/countries-democracies-autocracies-row","Classification by Lührmann et al. (2018) based on expert estimates by V-Dem.","05_Resources/05b_Sources-Background/Countries_that_are_democracies_and_autocracies_a519aa06.md"
"3504a780abb8","md","05_Resources","05b_Sources-Background","Crop Yields","3","492","0","background-reading","Existential Risk & Superintelligence","structural","blog_post","Hannah Ritchie; Pablo Rosado; Max Roser","2022-10-25","https://ourworldindata.org/crop-yields","Increasing crop yields is crucial to improve food security, living standards, and reduce human impacts on the environment.","05_Resources/05b_Sources-Background/Crop_Yields_042899e6.md"
"b3839fe5844c","md","05_Resources","05b_Sources-Background","Defining Insider Threats | CISA","6","1944","0","cyber-offense|agentic-AI|tool-use","Agentic Misalignment","misuse|misalignment","blog_post","","2017-03-01","https://www.cisa.gov/topics/physical-security/insider-threat-mitigation/defining-insider-threats","Insider threats present a complex and dynamic risk affecting the public and private domains of all critical infrastructure sectors.","05_Resources/05b_Sources-Background/Defining_Insider_Threats_CISA_9afeb970.md"
"b18dff4f6333","md","05_Resources","05b_Sources-Background","Expansion microscopy - Wikipedia","6","3033","0","background-reading","Pretraining Data Filtering","misalignment","blog_post","","2015-10-21","https://en.wikipedia.org/wiki/Expansion_microscopy","Wikipedia entry on expansion microscopy, a sample-preparation technique that physically enlarges biological specimens for higher-resolution imaging; kept as scientific background.","05_Resources/05b_Sources-Background/Expansion_microscopy_-_Wikipedia_42b2892c.md"
"3035f8083f98","md","05_Resources","05b_Sources-Background","External validity - Wikipedia","12","5482","0","background-reading","AI Evaluations & Benchmarks","misalignment","blog_post","","","https://en.wikipedia.org/wiki/External_validity","Mathematical analysis of external validity concerns a determination of whether generalization across heterogeneous populations is feasible, and devising statistical and computational methods that produce valid generalizations.[[4]](https://en.wikipedia.org#citenote-pb-2014-4)","05_Resources/05b_Sources-Background/External_validity_-_Wikipedia_c3e552b8.md"
"969f13963d80","md","05_Resources","05b_Sources-Background","Externality - Wikipedia","32","15192","0","background-reading","Existential Risk & Superintelligence","misalignment","blog_post","","","https://en.wikipedia.org/wiki/Externality","In economics, an externality is a cost or benefit to an uninvolved third party that arises as an effect of another party's (or parties') activity.","05_Resources/05b_Sources-Background/Externality_-_Wikipedia_9530d9ad.md"
"1b8579c8744a","md","05_Resources","05b_Sources-Background","Five Eyes - Wikipedia","18","9895","0","background-reading|cyber-offense|governance|regulation","Existential Risk & Superintelligence","misuse|structural","blog_post","","","https://en.wikipedia.org/wiki/Five_Eyes","This system was developed by the FVEY to monitor the communications of the","05_Resources/05b_Sources-Background/Five_Eyes_-_Wikipedia_090eb4e2.md"
"61bfcec683cb","md","05_Resources","05b_Sources-Background","Four Asian Tigers - Wikipedia","12","6045","0","background-reading","Existential Risk & Superintelligence","misalignment","blog_post","","","https://en.wikipedia.org/wiki/Four_Asian_Tigers","The Four Asian Tigers (a.k.a. the Four Asian Dragons or Four Little Dragons in Korean and Chinese) are the developed Asian economies of Hong Kong, Singapore, South Korea, and Taiwan. [1] Between the early","05_Resources/05b_Sources-Background/Four_Asian_Tigers_-_Wikipedia_0a522b8a.md"
